{
  "$schema": "http://json-schema.org/draft-07/schema#",
  "title": "GUI-Enhance FSM",
  "description": "Guides generation and provides the basis for validation. Describes WHAT must be true of the environment (which facts are gated behind which interactions), never HOW to implement it. No selectors, no DOM structure, no component choices -- those belong entirely to the coding agent.",
  "type": "object",
  "required": ["meta", "states", "actions", "fact_acquisition", "budget"],
  "properties": {
    "meta": {
      "type": "object",
      "required": ["task_id", "domain", "app_concept"],
      "properties": {
        "task_id": { "type": "string" },
        "domain": { "type": "string", "description": "e.g. Developer Tools, Financial ERP, Observability" },
        "app_concept": { "type": "string", "description": "One line: what the app pretends to be." },
        "seed": { "type": "integer" }
      }
    },

    "signature_vars": {
      "type": "object",
      "description": "Page signature sigma: the controllable configuration carried across states.",
      "additionalProperties": {
        "type": "object",
        "required": ["type"],
        "properties": {
          "type": { "enum": ["string", "int", "bool", "enum", "set"] },
          "values": { "type": "array" },
          "default": {},
          "description": { "type": "string" }
        }
      }
    },

    "states": {
      "type": "array",
      "minItems": 2,
      "items": {
        "type": "object",
        "required": ["id", "page", "description"],
        "properties": {
          "id": { "type": "string" },
          "page": { "type": "string", "description": "Logical page identity." },
          "description": { "type": "string" },
          "initial": { "type": "boolean" },
          "visible_data": {
            "type": "string",
            "description": "Prose: what data is legible to a user standing in this state. The generator must not render more than this."
          }
        }
      }
    },

    "actions": {
      "type": "array",
      "items": {
        "type": "object",
        "required": ["id", "from", "to", "description"],
        "properties": {
          "id": { "type": "string" },
          "from": { "type": "string" },
          "to": { "type": "string" },
          "description": {
            "type": "string",
            "description": "Semantic intent of the action, e.g. 'apply the branch facet'. NOT an implementation instruction."
          },
          "precondition": { "type": "string", "description": "Boolean constraint over signature_vars; empty means always available." },
          "effect": { "type": "object", "description": "Deterministic signature updates." },
          "navigates": { "type": "boolean" }
        }
      }
    },

    "fact_acquisition": {
      "type": "array",
      "description": "How each answer-critical fact from S0 is earned. This is the contract the ground-truth script must satisfy and the coverage checker validates.",
      "items": {
        "type": "object",
        "required": ["fact_group", "fields", "modality", "state", "path"],
        "properties": {
          "fact_group": { "type": "string" },
          "records": {
            "description": "Record indices covered, or 'all' / 'qualifying'.",
            "oneOf": [{ "type": "array", "items": { "type": "integer" } }, { "type": "string" }]
          },
          "fields": { "type": "array", "items": { "type": "string" } },
          "role": { "enum": ["payload", "selection"] },
          "modality": {
            "type": "string",
            "description": "Free-form. Inspiration, not a menu -- mixing several within one environment is encouraged. Examples: rendered-text, table-cell, file-export-download, chart-tooltip-hover, per-datapoint-scattered, form-gated-result, modal-only, accordion-collapsed, canvas-rendered, cross-app-join, sort-or-paginate-to-reach."
          },
          "state": { "type": "string", "description": "State in which the fact becomes legible." },
          "path": { "type": "array", "items": { "type": "string" }, "description": "Action ids from the initial state." },
          "repeat_per_record": {
            "type": "boolean",
            "description": "True when the path must be walked once per record (scattered collection) rather than yielding all records at once."
          },
          "notes": { "type": "string" }
        }
      }
    },

    "budget": {
      "type": "object",
      "required": ["min_actions", "max_actions"],
      "properties": {
        "min_actions": { "type": "integer", "description": "Lower bound guarantees the environment poses real GUI work." },
        "max_actions": { "type": "integer", "description": "Upper bound prevents degenerating into a test of patience." }
      }
    },

    "noise_plan": {
      "type": "object",
      "description": "UI chrome only -- never participates in fact acquisition, so it cannot threaten correctness.",
      "properties": {
        "distractor_records": { "type": "string", "description": "Which non-critical corpus records to surface as noise." },
        "chrome": { "type": "array", "items": { "type": "string" } }
      }
    }
  }
}
