{
  "meta": {
    "task_id": "ci-build-audit",
    "domain": "Developer Tools / CI-CD",
    "app_concept": "Forge CI -- a continuous integration dashboard for browsing pipeline runs across branches.",
    "seed": 1337
  },

  "signature_vars": {
    "branch_facet": { "type": "enum", "values": ["", "main", "release/2.4", "feat/search-index", "feat/oauth", "hotfix/tls"], "default": "", "description": "Active branch filter; empty means unfiltered." },
    "status_facet": { "type": "enum", "values": ["", "passed", "failed", "canceled"], "default": "", "description": "Active status filter." },
    "page_index": { "type": "int", "default": 0 },
    "open_build": { "type": "string", "default": "", "description": "build_id whose detail surface is open." },
    "commit_expanded": { "type": "bool", "default": false },
    "actions_tab_open": { "type": "bool", "default": false }
  },

  "states": [
    {
      "id": "s_landing",
      "page": "overview",
      "initial": true,
      "description": "Pipeline health overview. Entry point.",
      "visible_data": "Aggregate counters and decorative sparklines only. No per-build field values of any kind."
    },
    {
      "id": "s_list",
      "page": "builds",
      "description": "Paginated build list, unfiltered.",
      "visible_data": "Per row: build_id, started_at, runner, test_suite. Branch, status, duration and commit sha are NOT columns here and must not be rendered on this surface."
    },
    {
      "id": "s_filters",
      "page": "builds",
      "description": "Faceted filter panel open over the list.",
      "visible_data": "Facet option labels (branch names, status names) as selectable controls. No association between a facet and any specific build is shown."
    },
    {
      "id": "s_filtered",
      "page": "builds",
      "description": "List narrowed by the active facets.",
      "visible_data": "Only rows matching the facets, same columns as s_list. Still no duration and no commit sha."
    },
    {
      "id": "s_actions_tab",
      "page": "builds",
      "description": "Actions tab expanded on the list toolbar, revealing the export control.",
      "visible_data": "Export controls only."
    },
    {
      "id": "s_exported",
      "page": "builds",
      "description": "A CSV of the full build inventory has been downloaded to disk.",
      "visible_data": "The downloaded file carries build_id, branch, status, started_at, runner, test_suite for every build. It deliberately omits duration_sec and commit_sha -- those are not obtainable this way."
    },
    {
      "id": "s_detail",
      "page": "build_detail",
      "description": "Detail surface for a single build.",
      "visible_data": "Summary fields for one build. duration_sec is NOT printed as text; it is encoded in a timing chart and only surfaces as a tooltip on hover."
    },
    {
      "id": "s_detail_timing",
      "page": "build_detail",
      "description": "Timing tooltip surfaced for the open build.",
      "visible_data": "The exact duration_sec of the open build, as tooltip text."
    },
    {
      "id": "s_detail_commit",
      "page": "build_detail",
      "description": "Commit details accordion expanded for the open build.",
      "visible_data": "The full 40-character commit_sha of the open build. Collapsed by default; the list surfaces at most a shortened form elsewhere."
    }
  ],

  "actions": [
    { "id": "a_open_builds",   "from": "s_landing",  "to": "s_list",     "description": "Navigate from the overview into the build inventory.", "navigates": true },
    { "id": "a_paginate",      "from": "s_list",     "to": "s_list",     "description": "Move to another page of the build list.", "effect": { "page_index": "+1" } },
    { "id": "a_open_filters",  "from": "s_list",     "to": "s_filters",  "description": "Open the faceted filter panel." },
    { "id": "a_facet_branch",  "from": "s_filters",  "to": "s_filters",  "description": "Select a branch facet value.", "effect": { "branch_facet": "<chosen>" } },
    { "id": "a_facet_status",  "from": "s_filters",  "to": "s_filters",  "description": "Select a status facet value.", "effect": { "status_facet": "<chosen>" } },
    { "id": "a_apply_facets",  "from": "s_filters",  "to": "s_filtered", "description": "Commit the facet selection and narrow the list.", "precondition": "branch_facet != '' or status_facet != ''" },

    { "id": "a_open_actions",  "from": "s_list",     "to": "s_actions_tab", "description": "Expand the Actions tab on the list toolbar.", "effect": { "actions_tab_open": true } },
    { "id": "a_export_csv",    "from": "s_actions_tab", "to": "s_exported", "description": "Trigger the inventory export and receive a CSV file.", "precondition": "actions_tab_open == true" },
    { "id": "a_dismiss_export", "from": "s_exported", "to": "s_list", "description": "Return to the inventory after the download completes.", "effect": { "actions_tab_open": false } },

    { "id": "a_open_detail",   "from": "s_filtered", "to": "s_detail",   "description": "Open the detail surface for one build in the narrowed list.", "effect": { "open_build": "<chosen>" }, "navigates": true },
    { "id": "a_hover_timing",  "from": "s_detail",   "to": "s_detail_timing", "description": "Surface the timing tooltip for the open build.", "precondition": "open_build != ''" },
    { "id": "a_expand_commit", "from": "s_detail",   "to": "s_detail_commit", "description": "Expand the collapsed commit details section.", "precondition": "open_build != ''", "effect": { "commit_expanded": true } },
    { "id": "a_unhover_timing", "from": "s_detail_timing", "to": "s_detail", "description": "Move off the timing chart; the tooltip is a hover affordance, not a rendered field." },
    { "id": "a_collapse_commit", "from": "s_detail_commit", "to": "s_detail", "description": "Collapse the commit details section again.", "effect": { "commit_expanded": false } },
    { "id": "a_back_to_list",  "from": "s_detail",   "to": "s_filtered",  "description": "Leave the detail surface and return to the narrowed list.", "effect": { "open_build": "", "commit_expanded": false }, "navigates": true },
    { "id": "a_clear_facets",  "from": "s_filtered", "to": "s_list", "description": "Clear the active facets and return to the full inventory.", "effect": { "branch_facet": "", "status_facet": "", "page_index": 0 } }
  ],

  "fact_acquisition": [
    {
      "fact_group": "selection_via_export",
      "records": "all",
      "fields": ["branch", "status"],
      "role": "selection",
      "modality": "file-export-download",
      "state": "s_exported",
      "path": ["a_open_builds", "a_open_actions", "a_export_csv"],
      "repeat_per_record": false,
      "notes": "Branch and status are never rendered as list columns, so membership in the answer set cannot be read off the screen. The agent must find the Actions tab, export the inventory, and parse the downloaded CSV -- or fall back to reading each build's detail surface one at a time. The export deliberately omits duration_sec and commit_sha."
    },
    {
      "fact_group": "duration_scattered",
      "records": "qualifying",
      "fields": ["duration_sec"],
      "role": "payload",
      "modality": "chart-tooltip-hover + per-datapoint-scattered",
      "state": "s_detail_timing",
      "path": ["a_open_builds", "a_open_filters", "a_facet_branch", "a_facet_status", "a_apply_facets", "a_open_detail", "a_hover_timing"],
      "repeat_per_record": true,
      "notes": "No surface anywhere lists durations together. Each qualifying build's duration exists only as a tooltip on its own detail page, so the sum has to be assembled one datapoint at a time -- once per qualifying build, with a return to the list in between."
    },
    {
      "fact_group": "sha_behind_accordion",
      "records": "qualifying",
      "fields": ["commit_sha"],
      "role": "payload",
      "modality": "accordion-collapsed",
      "state": "s_detail_commit",
      "path": ["a_open_builds", "a_open_filters", "a_facet_branch", "a_facet_status", "a_apply_facets", "a_open_detail", "a_expand_commit"],
      "repeat_per_record": true,
      "notes": "The list may show a 7-char short sha at most; the full 40-char value lives only inside a collapsed section on the detail surface. Which build to read it from is not knowable until the durations have been collected."
    }
  ],

  "budget": { "min_actions": 12, "max_actions": 45 },

  "noise_plan": {
    "distractor_records": "All 48 corpus records are surfaced. The 18 records more than one field-flip away from the answer set are genuine corpus rows, not fabricated -- no synthetic data is injected, so the original CLI answer is structurally unchanged.",
    "chrome": [
      "A 'Runner fleet health' sidebar widget with unrelated gauges",
      "A dismissible product-announcement banner above the list",
      "An 'Insights' tab adjacent to Actions containing unrelated aggregate charts",
      "A notifications bell with a few unrelated items"
    ]
  }
}
